{
  "trace_id": "agentinstruct-os_11",
  "agent_name": "agentinstruct-os",
  "framework": "raw",
  "task_value_score": 1.0,
  "steps": [
    {
      "id": 1,
      "type": "tool_call",
      "content": "Think: To check the current users logged into the system with bash shell, I first need to access the system's password file /etc/passwd. This file includes user account information, including the login shell and home directory.\n\nAct: bash\n\n```bash\ncat /etc/passwd\n```",
      "tokens": 273,
      "tool_name": "bash",
      "tool_params": {
        "command": "cat /etc/passwd"
      },
      "input_context": "Now, I will start a new problem in a new OS. My problem is:\n\nCheck the current users logged into the system who have a bash shell. Print out those users' login, shell, and their home directory.",
      "output": "The output of the OS:\n\nroot:x:0:0:root:/root:/bin/bash\ndaemon:x:1:1:daemon:/usr/sbin:/usr/sbin/nologin\nbin:x:2:2:bin:/bin:/usr/sbin/nologin\nsys:x:3:3:sys:/dev:/usr/sbin/nologin\nsync:x:4:65534:sync:/bin:/bin/sync\ngames:x:5:60:games:/usr/games:/usr/sbin/nologin\nman:x:6:12:man:/var/cache/man:/usr/sbin/nologin\nlp:x:7:7:lp:/var/spool/lpd:/usr/sbin/nologin\nmail:x:8:8:mail:/var/mail:/usr/sbin/nologin\nnews:x:9:9:news:/var/spool/news:/usr/sbin/nologin\nuucp:x:10:10:uucp:/var/spool/uucp:/usr/sbin/nologin\nproxy:x:13:13:proxy:/bin:/usr/sbin/nologin\nwww-data:x:33:33:www-data:/var/www:/usr/sbin/nologin\nbackup:x:34:34:backup:/var/backups:/usr/sbin/nologin\nlist:x:38:38:Mailing List Manager:/var/list:/usr/sbin/nologin\nirc:x:39:39:ircd:/var/run/ircd:/usr/sbin/nologin\ngnats:x:41:41:Gnats Bug-Repo\n[truncated because the output is too long]",
      "tool_success": true
    },
    {
      "id": 2,
      "type": "tool_call",
      "content": "Think: The password file contains records for many users and not all of them have a bash shell based on their last entry in each line. I need to filter those lines which have \"/bin/bash\" which signifies that the user's login shell is bash.\n\nAct: bash\n\n```bash\ncat /etc/passwd | grep \"/bin/bash\"\n```",
      "tokens": 92,
      "tool_name": "bash",
      "tool_params": {
        "command": "cat /etc/passwd | grep \"/bin/bash\""
      },
      "output": "The output of the OS:\n\nroot:x:0:0:root:/root:/bin/bash\nroot@8cd1ba423ce0:/#",
      "tool_success": true
    },
    {
      "id": 3,
      "type": "tool_call",
      "content": "Think: Now that I have the records of users who are using \"/bin/bash\" shell, I need to extract the username, the home directory, and the shell using `cut` command\u2019s `-d` and `-f` options. The `-d` option is used to specify the delimiter, which is `:` in this case. The `-f` option is used to specify the fields that we want to extract, which are 1st field (username), 6th field (home directory) and 7th field (shell).\n\nAct: bash\n\n```bash\ncat /etc/passwd | grep \"/bin/bash\" | cut -d: -f1,6,7\n```",
      "tokens": 139,
      "tool_name": "bash",
      "tool_params": {
        "command": "cat /etc/passwd | grep \"/bin/bash\" | cut -d: -f1,6,7"
      },
      "output": "The output of the OS:\n\nroot:/root:/bin/bash\nroot@8cd1ba423ce0:/#",
      "tool_success": true
    },
    {
      "id": 4,
      "type": "tool_call",
      "content": "Think: Now I get the user info, however, the format of the info is not the required format. I should convert the format into \"User: <login>, Home Directory: <directory>, Shell: <shell>\".\n\nAct: bash\n\n```bash\ncat /etc/passwd | grep \"/bin/bash\" | cut -d: -f1,6,7 | awk -F: '{print \"User: \" $1 \", Home Directory: \" $2 \", Shell: \" $3}'\n```",
      "tokens": 106,
      "tool_name": "bash",
      "tool_params": {
        "command": "cat /etc/passwd | grep \"/bin/bash\" | cut -d: -f1,6,7 | awk -F: '{print \"User: \" $1 \", Home Directory: \" $2 \", Shell: \" $3}'"
      },
      "output": "The output of the OS:\n\nUser: root, Home Directory: /root, Shell: /bin/bash\nroot@8cd1ba423ce0:/#",
      "tool_success": true
    },
    {
      "id": 5,
      "type": "reasoning",
      "content": "Think: Now I get the answer, the user is root.\n\nAct: answer(User: root, Home Directory: /root, Shell: /bin/bash)",
      "tokens": 28
    }
  ],
  "total_tokens": 638,
  "metadata": {
    "source": "huggingface:zai-org/AgentInstruct",
    "dataset": "zai-org/AgentInstruct",
    "row_id": "os_11",
    "domain": "os",
    "task": "Check the current users logged into the system who have a bash shell. Print out those users' login, shell, and their home directory."
  }
}
