{
  "trace_id": "run01_before",
  "agent_name": "support-agent",
  "framework": "raw",
  "task_value_score": 1.0,
  "steps": [
    {
      "id": 1,
      "step_type": "reasoning",
      "content": "Parse the refund request for order ORD-1.",
      "tokens": 300
    },
    {
      "id": 2,
      "step_type": "tool_call",
      "content": "get order details",
      "tokens": 120,
      "tool_name": "get_order",
      "tool_success": true
    },
    {
      "id": 3,
      "step_type": "reasoning",
      "content": "Parse the refund request for order ORD-1.",
      "tokens": 300
    },
    {
      "id": 4,
      "step_type": "tool_call",
      "content": "check eligibility",
      "tokens": 110,
      "tool_name": "check_eligibility",
      "tool_success": false
    },
    {
      "id": 5,
      "step_type": "tool_call",
      "content": "check eligibility",
      "tokens": 110,
      "tool_name": "check_eligibility",
      "tool_success": true
    },
    {
      "id": 6,
      "step_type": "tool_call",
      "content": "process the refund",
      "tokens": 130,
      "tool_name": "process_refund",
      "tool_success": true
    },
    {
      "id": 7,
      "step_type": "reasoning",
      "content": "Confirm the refund and notify the customer.",
      "tokens": 160
    }
  ]
}