{
  "trace_id": "agentinstruct-os_2",
  "agent_name": "agentinstruct-os",
  "framework": "raw",
  "task_value_score": 1.0,
  "steps": [
    {
      "id": 1,
      "type": "tool_call",
      "content": "Think: To count the files in /etc, I need to print all the files in it.\n\nAct: bash\n\n```bash\nls /etc\n```",
      "tokens": 63,
      "tool_name": "bash",
      "tool_params": {
        "command": "ls /etc"
      },
      "input_context": "You are an assistant that will act like a person, I'will play the role of linux(ubuntu) operating system. Your goal is to implement the operations required by me or answer to the question proposed by me. For each of your turn, you should first think what you should do, and then take exact one of the three actions: \"bash\", \"finish\" or \"answer\". \n\n1. If you think you should execute some bash code, take bash action, and you should print like this:\n\nThink: put your thought here.\n\nAct: bash\n\n```bash\n# put your bash code here\n```\n\n2. If you think you have finished the task, take finish action, and you should print like this:\n\nThink: put your thought here.\n\nAct: finish\n\n3. If you think you have got the answer to the question, take answer action, and you should print like this:\n\nThink: put your thought here.\n\nAct: answer(Your answer to the question should be put in this pair of parentheses)\n\nIf the output is too long, I will truncate it. The truncated output is not complete. You have to deal with the truncating problem by yourself. Attention, your bash code should not contain any input operation. Once again, you should take only exact one of the three actions in each turn.\n\nNow, my problem is:\n\ntell me how many files are in the directory \"/etc\"?",
      "output": "The output of the OS:\ncpi cron.hourly fuse.conf iproute2 lvm networkd-dispatcher protocols selinux tmpfiles.d [truncated because the output is too long]",
      "tool_success": true
    },
    {
      "id": 2,
      "type": "tool_call",
      "content": "Think: The output has been truncated because it is too long, so I need to count files by script directly.\n\nAct: bash\n\n```bash\nls -1 /etc | wc -l\n```",
      "tokens": 43,
      "tool_name": "bash",
      "tool_params": {
        "command": "ls -1 /etc | wc -l"
      },
      "output": "The output of the OS:\n220",
      "tool_success": true
    },
    {
      "id": 3,
      "type": "reasoning",
      "content": "Think: Now I get the answer, it is 220.\n\nAct: answer(220)",
      "tokens": 14
    },
    {
      "id": 4,
      "type": "tool_call",
      "content": "Think: Let's first examine the list of files and directories along with their permissions using the `ls -l` command.\n\nAct: bash\n\n```bash\nls -l\n```",
      "tokens": 198,
      "tool_name": "bash",
      "tool_params": {
        "command": "ls -l"
      },
      "input_context": "Now, I will start a new problem in a new OS. My problem is:\n\nCount how many files or directories in the current directory have the read permission for the user.",
      "output": "The output of the OS:\n\ntotal 72\nlrwxrwxrwx    1 root root    7 Aug  1 02:04 bin -> usr/bin\ndrwxr-xr-x    2 root root 4096 Apr 15  2020 boot\ndrwxr-xr-x    5 root root  360 Sep  9 09:36 dev\ndrwxr-xr-x    1 root root 4096 Sep  9 09:36 etc\ndrwxr-xr-x    2 root root 4096 Apr 15  2020 home\nlrwxrwxrwx    1 root root    7 Aug  1 02:04 lib -> usr/lib\nlrwxrwxrwx    1 root root    9 Aug  1 02:04 lib32 -> usr/lib32\nlrwxrwxrwx    1 root root    9 Aug  1 02:04 lib64 -> usr/lib64\nlrwxrwxrwx    1 root root   10 Aug  1 02:04 libx32 -> usr/libx32\ndrwxr-xr-x    2 root root 4096 Aug  1 02:04 media\ndrwxr-xr-x    2 root ro\n[truncated because the output is too long]",
      "tool_success": true
    },
    {
      "id": 5,
      "type": "tool_call",
      "content": "Think: The output has been truncated because it is too long. However, based on the output, we can see that the permissions are displayed in the first column. If a file or directory has read permission for the user, the fourth character of this field will be an \"r\". So, let's count these entries only.\n\nAct: bash\n\n```bash\nls -l | grep -c '^...r'\n```",
      "tokens": 98,
      "tool_name": "bash",
      "tool_params": {
        "command": "ls -l | grep -c '^...r'"
      },
      "output": "The output of the OS:\n\n0\nroot@90194a0f874c:/#",
      "tool_success": true
    },
    {
      "id": 6,
      "type": "reasoning",
      "content": "Think: Now I get the answer, it is 0. \n\nAct: answer(0)",
      "tokens": 13
    }
  ],
  "total_tokens": 429,
  "metadata": {
    "source": "huggingface:zai-org/AgentInstruct",
    "dataset": "zai-org/AgentInstruct",
    "row_id": "os_2",
    "domain": "os",
    "task": "Count how many files or directories in the current directory have the read permission for the user."
  }
}
