{
  "agent_name": "managed-python-repair-v2",
  "framework": "trice-live",
  "metadata": {
    "task": "Deduplicate helper logic without editing tests.",
    "task_id": "dedupe-helpers"
  },
  "steps": [
    {
      "content": "Deduplicate helper logic without editing tests.",
      "id": 1,
      "input_context": "Deduplicate helper logic without editing tests.",
      "tokens": 8,
      "type": "reasoning"
    },
    {
      "content": "Run failing verifier before edit",
      "id": 2,
      "output": "=================================== ERRORS ====================================\n_ ERROR collecting benchmark/trice/results/v2-broad-smoke/tasks/dedupe-helpers/replicate-1/dedupe-helpers/round-1/baseline-full-context/workspace/tests/test_textutil.py _\nImportError while importing test module 'C:\\Users\\zulfa\\TraceRazor\\benchmark\\trice\\results\\v2-broad-smoke\\tasks\\dedupe-helpers\\replicate-1\\dedupe-helpers\\round-1\\baseline-full-context\\workspace\\tests\\test_textutil.py'.\nHint: make sure your test modules/packages have valid Python names.\nTraceback:\nC:\\Users\\zulfa\\AppData\\Local\\Programs\\Python\\Python311\\Lib\\importlib\\__init__.py:126: in import_module\n    return _bootstrap._gcd_import(name[level:], package, level)\n           ^^^^^^^^^^^^^^^^^^^^^^^^^^^^^^^^^^^^^^^^^^^^^^^^^^^^\ntests\\test_textutil.py:1: in <module>\n    import textutil\nE   ModuleNotFoundError: No module named 'textutil'\n=========================== short test summary info ===========================\nERROR tests\\test_textutil.py\n!!!!!!!!!!!!!!!!!!! Interrupted: 1 error during collection !!!!!!!!!!!!!!!!!!!!\n1 error in <duration>",
      "tokens": 96,
      "tool_name": "pytest",
      "tool_success": false,
      "type": "tool_call"
    },
    {
      "content": "Read editable project files",
      "id": 3,
      "output": "### conftest.py\n\n\n### utils_a.py\ndef normalize_name(name):\n    # strips and lowercases, but does not collapse internal whitespace\n    return name.strip().lower()\n\n\ndef label_for(name):\n    return f\"user:{normalize_name(name)}\"\n\n\n### utils_b.py\ndef normalize_name(name):\n    # collapses spaces but forgets tabs/newlines and lowercasing\n    return \" \".join(name.split(\" \")).strip()\n\n\ndef greeting(name):\n    return f\"hello {normalize_name(name)}\"\n",
      "tokens": 256,
      "tool_name": "read_project",
      "tool_success": true,
      "type": "tool_call"
    },
    {
      "content": "Read tests as behavior oracle",
      "id": 4,
      "output": "### tests/test_textutil.py\nimport textutil\nimport utils_a\nimport utils_b\n\n\ndef test_single_shared_implementation():\n    assert utils_a.normalize_name is textutil.normalize_name\n    assert utils_b.normalize_name is textutil.normalize_name\n\ndef test_lowercases_and_strips():\n    assert textutil.normalize_name(\"  Ada LOVELACE  \") == \"ada lovelace\"\n\ndef test_collapses_all_whitespace():\n    assert textutil.normalize_name(\"Ada\\t  Lovelace\\n\") == \"ada lovelace\"\n\ndef test_callers_still_work():\n    assert utils_a.label_for(\" Grace  Hopper \") == \"user:grace hopper\"\n    assert utils_b.greeting(\"ALAN\\tTuring\") == \"hello alan turing\"\n",
      "tokens": 256,
      "tool_name": "read_tests",
      "tool_success": true,
      "type": "tool_call"
    },
    {
      "content": "=================================== ERRORS ====================================\n_ ERROR collecting benchmark/trice/results/v2-broad-smoke/tasks/dedupe-helpers/replicate-1/dedupe-helpers/round-1/baseline-full-context/workspace/tests/test_textutil.py _\nImportError while importing test module 'C:\\Users\\zulfa\\TraceRazor\\benchmark\\trice\\results\\v2-broad-smoke\\tasks\\dedupe-helpers\\replicate-1\\dedupe-helpers\\round-1\\baseline-full-context\\workspace\\tests\\test_textutil.py'.\nHint: make sure your test modules/packages have valid Python names.\nTraceback:\nC:\\Users\\zulfa\\AppData\\Local\\Programs\\Python\\Python311\\Lib\\importlib\\__init__.py:126: in import_module\n    return _bootstrap._gcd_import(name[level:], package, level)\n           ^^^^^^^^^^^^^^^^^^^^^^^^^^^^^^^^^^^^^^^^^^^^^^^^^^^^\ntests\\test_textutil.py:1: in <module>\n    import textutil\nE   ModuleNotFoundError: No module named 'textutil'\n=========================== short test summary info ===========================\nERROR tests\\test_textutil.py\n!!!!!!!!!!!!!!!!!!! Interrupted: 1 error during collection !!!!!!!!!!!!!!!!!!!!\n1 error in <duration>\n=================================== ERRORS ====================================\n_ ERROR collecting benchmark/trice/results/v2-broad-smoke/tasks/dedupe-helpers/replicate-1/dedupe-helpers/round-1/baseline-full-context/workspace/tests/test_textutil.py _\nImportError while importing test module 'C:\\Users\\zulfa\\TraceRazor\\benchmark\\trice\\results\\v2-broad-smoke\\tasks\\dedupe-helpers\\replicate-1\\dedupe-helpers\\round-1\\baseline-full-context\\workspace\\tests\\test_textutil.py'.\nHint: make sure your test modules/packages have valid Python names.\nTraceback:\nC:\\Users\\zulfa\\AppData\\Local\\Programs\\Python\\Python311\\Lib\\importlib\\__init__.py:126: in import_module\n    return _bootstrap._gcd_import(name[level:], package, level)\n           ^^^^^^^^^^^^^^^^^^^^^^^^^^^^^^^^^^^^^^^^^^^^^^^^^^^^\ntests\\test_textutil.py:1: in <module>\n    import textutil\nE   ModuleNotFoundError: No module named 'textutil'\n=========================== short test summary info ===========================\nERROR tests\\test_textutil.py\n!!!!!!!!!!!!!!!!!!! Interrupted: 1 error during collection !!!!!!!!!!!!!!!!!!!!\n1 error in <duration>\n=================================== ERRORS ====================================\n_ ERROR collecting benchmark/trice/results/v2-broad-smoke/tasks/dedupe-helpers/replicate-1/dedupe-helpers/round-1/baseline-full-context/workspace/tests/test_textutil.py _\nImportError while importing test module 'C:\\Users\\zulfa\\TraceRazor\\benchmark\\trice\\results\\v2-broad-smoke\\tasks\\dedupe-helpers\\replicate-1\\dedupe-helpers\\round-1\\baseline-full-context\\workspace\\tests\\test_textutil.py'.\nHint: make sure your test modules/packages have valid Python names.\nTraceback:\nC:\\Users\\zulfa\\AppData\\Local\\Programs\\Python\\Python311\\Lib\\importlib\\__init__.py:126: in import_module\n    return _bootstrap._gcd_import(name[level:], package, level)\n           ^^^^^^^^^^^^^^^^^^^^^^^^^^^^^^^^^^^^^^^^^^^^^^^^^^^^\ntests\\test_textutil.py:1: in <module>\n    import textutil\nE   ModuleNotFoundError: No module named 'textutil'\n=========================== short test summary info ===========================\nERROR tests\\test_textutil.py\n!!!!!!!!!!!!!!!!!!! Interrupted: 1 error during collection !!!!!!!!!!!!!!!!!!!!\n1 error in <duration>",
      "flags": [
        "REDUNDANT"
      ],
      "id": 5,
      "tokens": 640,
      "type": "reasoning"
    },
    {
      "content": "Stale hypothesis scratchpad: re-read the same failure, consider unrelated renames, then discard this branch. This is intentionally receipt-safe noise.",
      "flags": [
        "REDUNDANT"
      ],
      "id": 6,
      "tokens": 420,
      "type": "reasoning"
    },
    {
      "content": "Ready to edit only source files and re-run the verifier.",
      "id": 7,
      "tokens": 64,
      "type": "reasoning"
    }
  ],
  "task_value_score": 0.0,
  "trace_id": "dedupe-helpers.decision"
}
