{
  "trace_id": "agentinstruct-os_18",
  "agent_name": "agentinstruct-os",
  "framework": "raw",
  "task_value_score": 1.0,
  "steps": [
    {
      "id": 1,
      "type": "tool_call",
      "content": "Think: First, I need to find and list all .jpeg files in the home directory including its subdirectories. The 'find' command is used with '~/' to represent the home directory. \n\nAct: bash\n\n```bash\nfind ~/ -name \"*.jpeg\"\n```",
      "tokens": 80,
      "tool_name": "bash",
      "tool_params": {
        "command": "find ~/ -name \"*.jpeg\""
      },
      "input_context": "Now, I will start a new problem in a new OS. My problem is:\n\nFind out the total used disk space by JPEG pictures in your home directory (including subdirectories).",
      "output": "The output of the OS:\n\n/root/medias/images/pic1.jpeg\n/root/medias/images/pic2.jpeg\nroot@6cf615885aba:/#",
      "tool_success": true
    },
    {
      "id": 2,
      "type": "tool_call",
      "content": "Think: Now, I have to find the used disk space by each file, to do this I can use the du -b command and pipe the output of the find command into it.\n\nAct: bash\n\n```bash\nfind ~/ -name \"*.jpeg\" | xargs du -b\n```",
      "tokens": 79,
      "tool_name": "bash",
      "tool_params": {
        "command": "find ~/ -name \"*.jpeg\" | xargs du -b"
      },
      "output": "The output of the OS:\n\n14\t/root/medias/images/pic1.jpeg\n14\t/root/medias/images/pic2.jpeg\nroot@6cf615885aba:/#",
      "tool_success": true
    },
    {
      "id": 3,
      "type": "tool_call",
      "content": "Think: Now that I have the disk usage by each file, I can sum up the sizes using awk. \n\nAct: bash\n\n```bash\nfind ~/ -name \"*.jpeg\" | xargs du -b | awk '{total = total + $1} END{print total}'\n```",
      "tokens": 59,
      "tool_name": "bash",
      "tool_params": {
        "command": "find ~/ -name \"*.jpeg\" | xargs du -b | awk '{total = total + $1} END{print total}'"
      },
      "output": "The output of the OS:\n\n28\nroot@6cf615885aba:/#",
      "tool_success": true
    },
    {
      "id": 4,
      "type": "reasoning",
      "content": "Think: Now, I got the answer as 28. It means the total disk space used by JPEG pictures in the home directory is 28 bytes.\n\nAct: answer(28)",
      "tokens": 34
    }
  ],
  "total_tokens": 252,
  "metadata": {
    "source": "huggingface:zai-org/AgentInstruct",
    "dataset": "zai-org/AgentInstruct",
    "row_id": "os_18",
    "domain": "os",
    "task": "Find out the total used disk space by JPEG pictures in your home directory (including subdirectories)."
  }
}
