{
  "trace_id": "agentinstruct-os_5",
  "agent_name": "agentinstruct-os",
  "framework": "raw",
  "task_value_score": 1.0,
  "steps": [
    {
      "id": 1,
      "type": "tool_call",
      "content": "Think: To count the files in /etc, I need to print all the files in it.\n\nAct: bash\n\n```bash\nls /etc\n```",
      "tokens": 63,
      "tool_name": "bash",
      "tool_params": {
        "command": "ls /etc"
      },
      "input_context": "You are an assistant that will act like a person, I'will play the role of linux(ubuntu) operating system. Your goal is to implement the operations required by me or answer to the question proposed by me. For each of your turn, you should first think what you should do, and then take exact one of the three actions: \"bash\", \"finish\" or \"answer\". \n\n1. If you think you should execute some bash code, take bash action, and you should print like this:\n\nThink: put your thought here.\n\nAct: bash\n\n```bash\n# put your bash code here\n```\n\n2. If you think you have finished the task, take finish action, and you should print like this:\n\nThink: put your thought here.\n\nAct: finish\n\n3. If you think you have got the answer to the question, take answer action, and you should print like this:\n\nThink: put your thought here.\n\nAct: answer(Your answer to the question should be put in this pair of parentheses)\n\nIf the output is too long, I will truncate it. The truncated output is not complete. You have to deal with the truncating problem by yourself. Attention, your bash code should not contain any input operation. Once again, you should take only exact one of the three actions in each turn.\n\nNow, my problem is:\n\ntell me how many files are in the directory \"/etc\"?",
      "output": "The output of the OS:\ncpi cron.hourly fuse.conf iproute2 lvm networkd-dispatcher protocols selinux tmpfiles.d [truncated because the output is too long]",
      "tool_success": true
    },
    {
      "id": 2,
      "type": "tool_call",
      "content": "Think: The output has been truncated because it is too long, so I need to count files by script directly.\n\nAct: bash\n\n```bash\nls -1 /etc | wc -l\n```",
      "tokens": 43,
      "tool_name": "bash",
      "tool_params": {
        "command": "ls -1 /etc | wc -l"
      },
      "output": "The output of the OS:\n220",
      "tool_success": true
    },
    {
      "id": 3,
      "type": "reasoning",
      "content": "Think: Now I get the answer, it is 220.\n\nAct: answer(220)",
      "tokens": 14
    },
    {
      "id": 4,
      "type": "tool_call",
      "content": "Think: I'll use the find command to list all the .txt files in the current directory and its subdirectories.\n\nAct: bash\n\n```bash\nfind . -name \"*.txt\"\n```",
      "tokens": 118,
      "tool_name": "bash",
      "tool_params": {
        "command": "find . -name \"*.txt\""
      },
      "input_context": "Now, I will start a new problem in a new OS. My problem is:\n\nIn the current directory containing various types of files, your task is to get the combined size of all files ending with `.txt` within the directory and its subdirectories. The file size should be returned in bytes.",
      "output": "The output of the OS:\n\n./usr/share/doc/mount/mount.txt\n./usr/share/doc/gnupg/examples/trustlist.txt\n./usr/share/vim/vim81/colors/README.txt\n./usr/share/vim/vim81/lang/README.txt\n./usr/share/vim/vim81/pack/dist/opt/matchit/doc/matchit.txt\n./usr/share/vim/vim81/compiler/README.txt\n[truncated because the output is too long]",
      "tool_success": true
    },
    {
      "id": 5,
      "type": "tool_call",
      "content": "Think: The output is truncated. I can pipe the output of the find command to wc -c command, to get the size in bytes of each file. However, doing this in one go might lead to a truncated output which will impair the final result. Thus, I will solve this problem step-by-step. First, saving the output of the find command into a file then read the file line by line and get size of each file.\n\nAct: bash\n\n```bash\nfind . -name \"*.txt\" > files.txt\n```",
      "tokens": 122,
      "tool_name": "bash",
      "tool_params": {
        "command": "find . -name \"*.txt\" > files.txt"
      },
      "output": "The output of the OS:\n\nroot@76fe756d014a:/#",
      "tool_success": true
    },
    {
      "id": 6,
      "type": "tool_call",
      "content": "Think: Now that all the files with .txt extension have been stored in files.txt file, I will read through each of these files line by line. For each file, I will get its size in bytes using the wc -c command.\n\nAct: bash\n\n```bash\nwhile IFS= read -r line; do wc -c \"$line\"; done < \"files.txt\"\n```",
      "tokens": 162,
      "tool_name": "bash",
      "tool_params": {
        "command": "while IFS= read -r line; do wc -c \"$line\"; done < \"files.txt\""
      },
      "output": "The output of the OS:\n\nwc: ./usr/share/doc/mount/mount.txt: No such file or directory\nwc: ./usr/share/doc/gnupg/examples/trustlist.txt: No such file or directory\n3274 ./usr/share/vim/vim81/colors/README.txt\n1720 ./usr/share/vim/vim81/lang/README.txt\n18644 ./usr/share/vim/vim81/pack/dist/opt/matchit/doc/matchit.txt\n[truncated because the output is too long]",
      "tool_success": false,
      "tool_error": "The output of the OS:\n\nwc: ./usr/share/doc/mount/mount.txt: No such file or directory\nwc: ./usr/share/doc/gnupg/examples/trustlist.txt: No such file or directory\n3274 ./usr/share/vim/vim81/colors/README.txt\n1720 ./usr/share/vim/vim81/lang/README.txt\n18644 ./usr/share/vim/vim81/pack/dist/opt/matchit/"
    },
    {
      "id": 7,
      "type": "tool_call",
      "content": "Think: The output is too long and has been truncated, which means preventing us from getting the correct sum. To avoid this, we can calculate one file at a time, adding the file size to a variable each time.\n\nAct: bash\n\n```bash\ntotal=0\nwhile IFS= read -r line; do\n  size=$(wc -c < \"$line\")\n  total=$((total + size))\ndone < \"files.txt\"\necho $total\n```",
      "tokens": 97,
      "tool_name": "bash",
      "tool_params": {
        "command": "total=0\nwhile IFS= read -r line; do\n  size=$(wc -c < \"$line\")\n  total=$((total + size))\ndone < \"files.txt\"\necho $total"
      },
      "output": "The output of the OS:\n\nroot@76fe756d014a:/#",
      "tool_success": true
    },
    {
      "id": 8,
      "type": "tool_call",
      "content": "Think: The operation was successful, but the output is not visible because of the shell color codes. It is necessary to strip these color codes to obtain the actual output.\n\nAct: bash\n\n```bash\ntotal=0\nwhile IFS= read -r line; do\n  size=$(wc -c < \"$line\")\n  total=$((total + size))\ndone < \"files.txt\"\necho $total | tr -cd '[:digit:]'\n```",
      "tokens": 154,
      "tool_name": "bash",
      "tool_params": {
        "command": "total=0\nwhile IFS= read -r line; do\n  size=$(wc -c < \"$line\")\n  total=$((total + size))\ndone < \"files.txt\"\necho $total | tr -cd '[:digit:]'"
      },
      "output": "The output of the OS:\n\n>   size=$(wc -c < \"$line\")\n>   total=$((total + size))\n> done < \"files.txt\"\nbash: ./usr/share/doc/mount/mount.txt: No such file or directory\nbash: ./usr/share/doc/gnupg/examples/trustlist.txt: No such file or directory\nroot@76fe756d014a:/# echo $total\n9827577",
      "tool_success": false,
      "tool_error": "The output of the OS:\n\n>   size=$(wc -c < \"$line\")\n>   total=$((total + size))\n> done < \"files.txt\"\nbash: ./usr/share/doc/mount/mount.txt: No such file or directory\nbash: ./usr/share/doc/gnupg/examples/trustlist.txt: No such file or directory\nroot@76fe756d014a:/# echo $total\n9827577"
    },
    {
      "id": 9,
      "type": "reasoning",
      "content": "Think: Now I have the sum of the sizes of all .txt files in the directory and its subdirectories. The total size is 9827577 bytes.\n\nAct: answer(9827577)",
      "tokens": 38
    }
  ],
  "total_tokens": 811,
  "metadata": {
    "source": "huggingface:zai-org/AgentInstruct",
    "dataset": "zai-org/AgentInstruct",
    "row_id": "os_5",
    "domain": "os",
    "task": "In the current directory containing various types of files, your task is to get the combined size of all files ending with `.txt` within the directory and its subdirectories. The file size should be returned in bytes."
  }
}
