{
  "trace_id": "agentinstruct-os_1",
  "agent_name": "agentinstruct-os",
  "framework": "raw",
  "task_value_score": 1.0,
  "steps": [
    {
      "id": 1,
      "type": "tool_call",
      "content": "Think: To count the files in /etc, I need to print all the files in it.\n\nAct: bash\n\n```bash\nls /etc\n```",
      "tokens": 63,
      "tool_name": "bash",
      "tool_params": {
        "command": "ls /etc"
      },
      "input_context": "You are an assistant that will act like a person, I'will play the role of linux(ubuntu) operating system. Your goal is to implement the operations required by me or answer to the question proposed by me. For each of your turn, you should first think what you should do, and then take exact one of the three actions: \"bash\", \"finish\" or \"answer\". \n\n1. If you think you should execute some bash code, take bash action, and you should print like this:\n\nThink: put your thought here.\n\nAct: bash\n\n```bash\n# put your bash code here\n```\n\n2. If you think you have finished the task, take finish action, and you should print like this:\n\nThink: put your thought here.\n\nAct: finish\n\n3. If you think you have got the answer to the question, take answer action, and you should print like this:\n\nThink: put your thought here.\n\nAct: answer(Your answer to the question should be put in this pair of parentheses)\n\nIf the output is too long, I will truncate it. The truncated output is not complete. You have to deal with the truncating problem by yourself. Attention, your bash code should not contain any input operation. Once again, you should take only exact one of the three actions in each turn.\n\nNow, my problem is:\n\ntell me how many files are in the directory \"/etc\"?",
      "output": "The output of the OS:\ncpi cron.hourly fuse.conf iproute2 lvm networkd-dispatcher protocols selinux tmpfiles.d [truncated because the output is too long]",
      "tool_success": true
    },
    {
      "id": 2,
      "type": "tool_call",
      "content": "Think: The output has been truncated because it is too long, so I need to count files by script directly.\n\nAct: bash\n\n```bash\nls -1 /etc | wc -l\n```",
      "tokens": 43,
      "tool_name": "bash",
      "tool_params": {
        "command": "ls -1 /etc | wc -l"
      },
      "output": "The output of the OS:\n220",
      "tool_success": true
    },
    {
      "id": 3,
      "type": "reasoning",
      "content": "Think: Now I get the answer, it is 220.\n\nAct: answer(220)",
      "tokens": 14
    },
    {
      "id": 4,
      "type": "tool_call",
      "content": "Think: First, I need to check the content of the log file 'system.log'.\n\nAct: bash\n\n```bash\ncat system.log\n```",
      "tokens": 103,
      "tool_name": "bash",
      "tool_params": {
        "command": "cat system.log"
      },
      "input_context": "Now, I will start a new problem in a new OS. My problem is:\n\nGiven the contents of a log file named 'system.log' in the current directory, figure out the total number of occurrences of the word \"error\".",
      "output": "The output of the OS:\n\nTimeout error --- task:33 --- on:worker:1908\nStarting routine backup --- task:144 --- on:worker:1912\nDisk I/O error --- task:55 --- on:worker:1951\nCompleted routine backup --- task:33 --- on:worker:1908\nUnauthorized access error --- task: 75 --- on:worker:1991\nroot@5e2097b1eb67:/#",
      "tool_success": true
    },
    {
      "id": 5,
      "type": "tool_call",
      "content": "Think: The log file 'system.log' contains the word \"error\". Let's use grep command to count the number of occurrence of the word 'error'.\n\nAct: bash\n\n```bash\ngrep -c 'error' system.log\n```",
      "tokens": 58,
      "tool_name": "bash",
      "tool_params": {
        "command": "grep -c 'error' system.log"
      },
      "output": "The output of the OS:\n\n3\nroot@5e2097b1eb67:/#",
      "tool_success": true
    },
    {
      "id": 6,
      "type": "reasoning",
      "content": "Think: Now I get the answer, it is 3.\n\nAct: answer(3)",
      "tokens": 13
    }
  ],
  "total_tokens": 294,
  "metadata": {
    "source": "huggingface:zai-org/AgentInstruct",
    "dataset": "zai-org/AgentInstruct",
    "row_id": "os_1",
    "domain": "os",
    "task": "Given the contents of a log file named 'system.log' in the current directory, figure out the total number of occurrences of the word \"error\"."
  }
}
