{
  "trace_id": "agentinstruct-os_3",
  "agent_name": "agentinstruct-os",
  "framework": "raw",
  "task_value_score": 1.0,
  "steps": [
    {
      "id": 1,
      "type": "tool_call",
      "content": "Think: As per the hint, first I need to fetch the last hundred lines of the 'numbers.txt' file.\n\nAct: bash\n\n```bash\ntail -n 100 numbers.txt\n```",
      "tokens": 143,
      "tool_name": "bash",
      "tool_params": {
        "command": "tail -n 100 numbers.txt"
      },
      "input_context": "Now, I will start a new problem in a new OS. My problem is:\n\nCount the total sum of numbers that lie within the last 100 lines of the text file \"numbers.txt\", where each line of the file has a single whole number. Report the sum as your answer.",
      "output": "The output of the OS:\n\n749\n515\n326\n897\n717\n474\n610\n819\n329\n67\n70\n477\n419\n573\n537\n309\n492\n258\n844\n287\n508\n460\n264\n742\n888\n718\n145\n118\n521\n707\n572\n308\n369\n978\n889\n266\n719\n724\n282\n946\n704\n831\n473\n474\n80\n649\n916\n840\n413\n917\n728\n749\n38\n520\n888\n440\n512\n337\n60\n404\n174\n419\n261\n35\n775\n32\n419\n641\n15\n643\n416\n928\n786\n340\n758\n559\n625\n208\n818\n241\n555\n330\n544\n465\n876\n896\n320\n344\n612\n865\n471\n322\n815\n963\n865\n189\n664\n306\n69\n503\nroot@3ab13359639a:/#",
      "tool_success": true
    },
    {
      "id": 2,
      "type": "tool_call",
      "content": "Think: The provided output shows the last 100 lines of the 'numbers.txt' file. Now, I will use 'awk' to get the sum of these numbers.\n\nAct: bash\n\n```bash\ntail -n 100 numbers.txt | awk '{s+=$1} END {print s}'\n```",
      "tokens": 64,
      "tool_name": "bash",
      "tool_params": {
        "command": "tail -n 100 numbers.txt | awk '{s+=$1} END {print s}'"
      },
      "output": "The output of the OS:\n\n51933\nroot@3ab13359639a:/#",
      "tool_success": true
    },
    {
      "id": 3,
      "type": "reasoning",
      "content": "Think: The output shows that the sum of the last 100 numbers in the file 'numbers.txt' is 51933.\n\nAct: answer(51933)",
      "tokens": 29
    }
  ],
  "total_tokens": 236,
  "metadata": {
    "source": "huggingface:zai-org/AgentInstruct",
    "dataset": "zai-org/AgentInstruct",
    "row_id": "os_3",
    "domain": "os",
    "task": "Count the total sum of numbers that lie within the last 100 lines of the text file \"numbers.txt\", where each line of the file has a single whole number. Report the sum as your answer."
  }
}
