{
  "agent_name": "managed-python-repair-v2",
  "framework": "trice-live",
  "metadata": {
    "condition": "trice-v2",
    "task": "You are in a small Python project. The public function `fetch_data` in `core.py` must be renamed to `load_records` everywhere it appears \u2014 the definition and every call site. The tests expect the old name to be gone entirely. Run `python3 -m pytest -q`, make the rename, and re-run the tests until they all pass. Do not modify any files under `tests/`.",
    "task_id": "rename-api"
  },
  "steps": [
    {
      "content": "You are in a small Python project. The public function `fetch_data` in `core.py` must be renamed to `load_records` everywhere it appears \u2014 the definition and every call site. The tests expect the old name to be gone entirely. Run `python3 -m pytest -q`, make the rename, and re-run the tests until they all pass. Do not modify any files under `tests/`.",
      "id": 1,
      "input_context": "You are in a small Python project. The public function `fetch_data` in `core.py` must be renamed to `load_records` everywhere it appears \u2014 the definition and every call site. The tests expect the old name to be gone entirely. Run `python3 -m pytest -q`, make the rename, and re-run the tests until they all pass. Do not modify any files under `tests/`.",
      "tokens": 82,
      "type": "reasoning"
    },
    {
      "content": "Run failing verifier before edit",
      "id": 2,
      "output": "F..                                                                      [100%]\n================================== FAILURES ===================================\n________________________ test_new_name_exists_old_gone ________________________\ntests\\test_rename.py:14: in test_new_name_exists_old_gone\n    assert hasattr(core, \"load_records\")\nE   AssertionError: assert False\nE    +  where False = hasattr(core, 'load_records')\n=========================== short test summary info ===========================\nFAILED tests\\test_rename.py::test_new_name_exists_old_gone - AssertionError: ...\n1 failed, 2 passed in <duration>",
      "tokens": 96,
      "tool_name": "pytest",
      "tool_success": false,
      "type": "tool_call"
    },
    {
      "content": "Read editable project files",
      "id": 3,
      "output": "### cli.py\nimport sys\n\nfrom core import fetch_data\n\n\ndef main(path):\n    records = fetch_data(path)\n    print(f\"{len(records)} records\")\n    return len(records)\n\n\nif __name__ == \"__main__\":\n    main(sys.argv[1])\n\n\n### conftest.py\n\n\n### core.py\nimport json\n\n\ndef fetch_data(path):\n    \"\"\"Load a list of record dicts from a JSON file.\"\"\"\n    with open(path, encoding=\"utf-8\") as fh:\n        data = json.load(fh)\n    if not isinstance(data, list):\n        raise TypeError(\"expected a JSON array of records\")\n    return data\n\n\n### report.py\nfrom core import fetch_data\n\n\ndef summarize(path):\n    records = fetch_data(path)\n    return {\"count\": len(records), \"keys\": sorted({k for r in records for k in r})}\n",
      "tokens": 256,
      "tool_name": "read_project",
      "tool_success": true,
      "type": "tool_call"
    },
    {
      "content": "Read tests as behavior oracle",
      "id": 4,
      "output": "### tests/test_rename.py\nimport json\n\nimport core\nimport cli\nimport report\n\n\ndef _write(tmp_path, rows):\n    p = tmp_path / \"rows.json\"\n    p.write_text(json.dumps(rows), encoding=\"utf-8\")\n    return str(p)\n\ndef test_new_name_exists_old_gone():\n    assert hasattr(core, \"load_records\")\n    assert not hasattr(core, \"fetch_data\")\n\ndef test_cli_uses_new_name(tmp_path):\n    assert cli.main(_write(tmp_path, [{\"a\": 1}, {\"a\": 2}])) == 2\n\ndef test_report_uses_new_name(tmp_path):\n    s = report.summarize(_write(tmp_path, [{\"a\": 1, \"b\": 2}]))\n    assert s == {\"count\": 1, \"keys\": [\"a\", \"b\"]}\n",
      "tokens": 256,
      "tool_name": "read_tests",
      "tool_success": true,
      "type": "tool_call"
    },
    {
      "content": "F..                                                                      [100%]\n================================== FAILURES ===================================\n________________________ test_new_name_exists_old_gone ________________________\ntests\\test_rename.py:14: in test_new_name_exists_old_gone\n    assert hasattr(core, \"load_records\")\nE   AssertionError: assert False\nE    +  where False = hasattr(core, 'load_records')\n=========================== short test summary info ===========================\nFAILED tests\\test_rename.py::test_new_name_exists_old_gone - AssertionError: ...\n1 failed, 2 passed in <duration>\nF..                                                                      [100%]\n================================== FAILURES ===================================\n________________________ test_new_name_exists_old_gone ________________________\ntests\\test_rename.py:14: in test_new_name_exists_old_gone\n    assert hasattr(core, \"load_records\")\nE   AssertionError: assert False\nE    +  where False = hasattr(core, 'load_records')\n=========================== short test summary info ===========================\nFAILED tests\\test_rename.py::test_new_name_exists_old_gone - AssertionError: ...\n1 failed, 2 passed in <duration>\nF..                                                                      [100%]\n================================== FAILURES ===================================\n________________________ test_new_name_exists_old_gone ________________________\ntests\\test_rename.py:14: in test_new_name_exists_old_gone\n    assert hasattr(core, \"load_records\")\nE   AssertionError: assert False\nE    +  where False = hasattr(core, 'load_records')\n=========================== short test summary info ===========================\nFAILED tests\\test_rename.py::test_new_name_exists_old_gone - AssertionError: ...\n1 failed, 2 passed in <duration>",
      "flags": [
        "REDUNDANT"
      ],
      "id": 5,
      "tokens": 640,
      "type": "reasoning"
    },
    {
      "content": "Stale hypothesis scratchpad: re-read the same failure, consider unrelated renames, then discard this branch. This is intentionally receipt-safe noise.",
      "flags": [
        "REDUNDANT"
      ],
      "id": 6,
      "tokens": 420,
      "type": "reasoning"
    },
    {
      "content": "Ready to edit only source files and re-run the verifier.",
      "id": 7,
      "tokens": 64,
      "type": "reasoning"
    },
    {
      "content": "Run verifier after managed edit",
      "id": 8,
      "output": "...                                                                      [100%]\n3 passed in <duration>",
      "tokens": 8,
      "tool_name": "pytest",
      "tool_success": true,
      "type": "tool_call"
    }
  ],
  "task_value_score": 1.0,
  "total_tokens": 349,
  "trace_id": "rename-api.trice-v2"
}
