{
  "agent_name": "managed-python-repair-v2",
  "framework": "trice-live",
  "metadata": {
    "condition": "baseline-full-context",
    "task": "You are in a small Python project. The package `mypkg` is broken: importing it fails, and the tests expect `run_pipeline` to be importable directly from the package. Run `python3 -m pytest -q` to see the errors, fix the package's imports/exports, and re-run the tests until they all pass. Do not modify any files under `tests/`.",
    "task_id": "fix-imports"
  },
  "steps": [
    {
      "content": "You are in a small Python project. The package `mypkg` is broken: importing it fails, and the tests expect `run_pipeline` to be importable directly from the package. Run `python3 -m pytest -q` to see the errors, fix the package's imports/exports, and re-run the tests until they all pass. Do not modify any files under `tests/`.",
      "id": 1,
      "input_context": "You are in a small Python project. The package `mypkg` is broken: importing it fails, and the tests expect `run_pipeline` to be importable directly from the package. Run `python3 -m pytest -q` to see the errors, fix the package's imports/exports, and re-run the tests until they all pass. Do not modify any files under `tests/`.",
      "tokens": 74,
      "type": "reasoning"
    },
    {
      "content": "Run failing verifier before edit",
      "id": 2,
      "output": "FF.                                                                      [100%]\n================================== FAILURES ===================================\n________________________ test_import_from_package_root ________________________\ntests\\test_pipeline.py:2: in test_import_from_package_root\n    from mypkg import run_pipeline\nE   ImportError: cannot import name 'run_pipeline' from 'mypkg' (C:\\Users\\zulfa\\TraceRazor\\benchmark\\trice\\results\\v2-smoke\\fix-imports\\round-1\\baseline-full-context\\workspace\\mypkg\\__init__.py)\n________________________________ test_pipeline ________________________________\ntests\\test_pipeline.py:6: in test_pipeline\n    from mypkg import run_pipeline\nE   ImportError: cannot import name 'run_pipeline' from 'mypkg' (C:\\Users\\zulfa\\TraceRazor\\benchmark\\trice\\results\\v2-smoke\\fix-imports\\round-1\\baseline-full-context\\workspace\\mypkg\\__init__.py)\n=========================== short test summary info ===========================\nFAILED tests\\test_pipeline.py::test_import_from_package_root - ImportError: c...\nFAILED tests\\test_pipeline.py::test_pipeline - ImportError: cannot import nam...\n2 failed, 1 passed in <duration>",
      "tokens": 96,
      "tool_name": "pytest",
      "tool_success": false,
      "type": "tool_call"
    },
    {
      "content": "Read editable project files",
      "id": 3,
      "output": "### conftest.py\n\n\n### mypkg/__init__.py\n\"\"\"Tiny ETL package.\"\"\"\n\n\n### mypkg/api.py\nfrom loaders import read_rows\n\n\ndef run_pipeline(rows):\n    \"\"\"Load raw rows and return them uppercased.\"\"\"\n    return [r.upper() for r in read_rows(rows)]\n\n\n### mypkg/loaders.py\ndef read_rows(rows):\n    \"\"\"Pretend-load: accept a list of raw strings.\"\"\"\n    return [r.strip() for r in rows if r.strip()]\n",
      "tokens": 256,
      "tool_name": "read_project",
      "tool_success": true,
      "type": "tool_call"
    },
    {
      "content": "Read tests as behavior oracle",
      "id": 4,
      "output": "### tests/test_pipeline.py\ndef test_import_from_package_root():\n    from mypkg import run_pipeline\n    assert callable(run_pipeline)\n\ndef test_pipeline():\n    from mypkg import run_pipeline\n    assert run_pipeline([\" a \", \"\", \"b\\n\"]) == [\"A\", \"B\"]\n\ndef test_submodule_still_importable():\n    from mypkg.loaders import read_rows\n    assert read_rows([\"x \"]) == [\"x\"]\n",
      "tokens": 256,
      "tool_name": "read_tests",
      "tool_success": true,
      "type": "tool_call"
    },
    {
      "content": "FF.                                                                      [100%]\n================================== FAILURES ===================================\n________________________ test_import_from_package_root ________________________\ntests\\test_pipeline.py:2: in test_import_from_package_root\n    from mypkg import run_pipeline\nE   ImportError: cannot import name 'run_pipeline' from 'mypkg' (C:\\Users\\zulfa\\TraceRazor\\benchmark\\trice\\results\\v2-smoke\\fix-imports\\round-1\\baseline-full-context\\workspace\\mypkg\\__init__.py)\n________________________________ test_pipeline ________________________________\ntests\\test_pipeline.py:6: in test_pipeline\n    from mypkg import run_pipeline\nE   ImportError: cannot import name 'run_pipeline' from 'mypkg' (C:\\Users\\zulfa\\TraceRazor\\benchmark\\trice\\results\\v2-smoke\\fix-imports\\round-1\\baseline-full-context\\workspace\\mypkg\\__init__.py)\n=========================== short test summary info ===========================\nFAILED tests\\test_pipeline.py::test_import_from_package_root - ImportError: c...\nFAILED tests\\test_pipeline.py::test_pipeline - ImportError: cannot import nam...\n2 failed, 1 passed in <duration>\nFF.                                                                      [100%]\n================================== FAILURES ===================================\n________________________ test_import_from_package_root ________________________\ntests\\test_pipeline.py:2: in test_import_from_package_root\n    from mypkg import run_pipeline\nE   ImportError: cannot import name 'run_pipeline' from 'mypkg' (C:\\Users\\zulfa\\TraceRazor\\benchmark\\trice\\results\\v2-smoke\\fix-imports\\round-1\\baseline-full-context\\workspace\\mypkg\\__init__.py)\n________________________________ test_pipeline ________________________________\ntests\\test_pipeline.py:6: in test_pipeline\n    from mypkg import run_pipeline\nE   ImportError: cannot import name 'run_pipeline' from 'mypkg' (C:\\Users\\zulfa\\TraceRazor\\benchmark\\trice\\results\\v2-smoke\\fix-imports\\round-1\\baseline-full-context\\workspace\\mypkg\\__init__.py)\n=========================== short test summary info ===========================\nFAILED tests\\test_pipeline.py::test_import_from_package_root - ImportError: c...\nFAILED tests\\test_pipeline.py::test_pipeline - ImportError: cannot import nam...\n2 failed, 1 passed in <duration>\nFF.                                                                      [100%]\n================================== FAILURES ===================================\n________________________ test_import_from_package_root ________________________\ntests\\test_pipeline.py:2: in test_import_from_package_root\n    from mypkg import run_pipeline\nE   ImportError: cannot import name 'run_pipeline' from 'mypkg' (C:\\Users\\zulfa\\TraceRazor\\benchmark\\trice\\results\\v2-smoke\\fix-imports\\round-1\\baseline-full-context\\workspace\\mypkg\\__init__.py)\n________________________________ test_pipeline ________________________________\ntests\\test_pipeline.py:6: in test_pipeline\n    from mypkg import run_pipeline\nE   ImportError: cannot import name 'run_pipeline' from 'mypkg' (C:\\Users\\zulfa\\TraceRazor\\benchmark\\trice\\results\\v2-smoke\\fix-imports\\round-1\\baseline-full-context\\workspace\\mypkg\\__init__.py)\n=========================== short test summary info ===========================\nFAILED tests\\test_pipeline.py::test_import_from_package_root - ImportError: c...\nFAILED tests\\test_pipeline.py::test_pipeline - ImportError: cannot import nam...\n2 failed, 1 passed in <duration>",
      "flags": [
        "REDUNDANT"
      ],
      "id": 5,
      "tokens": 640,
      "type": "reasoning"
    },
    {
      "content": "Stale hypothesis scratchpad: re-read the same failure, consider unrelated renames, then discard this branch. This is intentionally receipt-safe noise.",
      "flags": [
        "REDUNDANT"
      ],
      "id": 6,
      "tokens": 420,
      "type": "reasoning"
    },
    {
      "content": "Ready to edit only source files and re-run the verifier.",
      "id": 7,
      "tokens": 64,
      "type": "reasoning"
    },
    {
      "content": "Run verifier after managed edit",
      "id": 8,
      "output": "...                                                                      [100%]\n3 passed in <duration>",
      "tokens": 8,
      "tool_name": "pytest",
      "tool_success": true,
      "type": "tool_call"
    }
  ],
  "task_value_score": 1.0,
  "total_tokens": 1806,
  "trace_id": "fix-imports.baseline-full-context"
}
