{
  "trace_id": "agentinstruct-os_16",
  "agent_name": "agentinstruct-os",
  "framework": "raw",
  "task_value_score": 1.0,
  "steps": [
    {
      "id": 1,
      "type": "tool_call",
      "content": "Think: Check if there are any .txt files present in the current directory.\n\nAct: bash\n\n```bash\nls *.txt\n```",
      "tokens": 44,
      "tool_name": "bash",
      "tool_params": {
        "command": "ls *.txt"
      },
      "input_context": "Now, I will start a new problem in a new OS. My problem is:\n\nZip all .txt files in the current directory into an archive named 'archived_texts.zip'",
      "output": "The output of the OS:\n\nfile1.txt  file2.txt  file3.txt\nroot@193c97cbad3c:/#",
      "tool_success": true
    },
    {
      "id": 2,
      "type": "tool_call",
      "content": "Think: There are .txt files in the current directory. Now I can zip these files into archived_texts.zip.\n\nAct: bash\n\n```bash\nzip archived_texts.zip *.txt\n```",
      "tokens": 73,
      "tool_name": "bash",
      "tool_params": {
        "command": "zip archived_texts.zip *.txt"
      },
      "output": "The output of the OS:\n\n  adding: file1.txt (stored 0%)\n  adding: file2.txt (stored 0%)\n  adding: file3.txt (stored 0%)\nroot@193c97cbad3c:/#",
      "tool_success": true
    },
    {
      "id": 3,
      "type": "tool_call",
      "content": "Think: The .txt files have been added to the zip file successfully. Now check if the archived_texts.zip file has been created in the current directory.\n\nAct: bash\n\n```bash\nls *.zip\n```",
      "tokens": 61,
      "tool_name": "bash",
      "tool_params": {
        "command": "ls *.zip"
      },
      "output": "The output of the OS:\n\narchived_texts.zip\nroot@193c97cbad3c:/#",
      "tool_success": true
    },
    {
      "id": 4,
      "type": "reasoning",
      "content": "Think: The file 'archived_texts.zip' exists in the current directory. The task is finished.\n\nAct: finish",
      "tokens": 26
    }
  ],
  "total_tokens": 204,
  "metadata": {
    "source": "huggingface:zai-org/AgentInstruct",
    "dataset": "zai-org/AgentInstruct",
    "row_id": "os_16",
    "domain": "os",
    "task": "Zip all .txt files in the current directory into an archive named 'archived_texts.zip'"
  }
}
