{
  "trace_id": "tau-bench-task-1-trial-0",
  "agent_name": "tau-bench-airline-gpt-4o",
  "framework": "raw",
  "task_value_score": 0.0,
  "steps": [
    {
      "id": 1,
      "type": "reasoning",
      "content": "I can help you with that. First, I'll need your user ID and the reservation ID for the flight you want to change. Could you please provide those details?",
      "tokens": 38,
      "input_context": "system: # Airline Agent Policy\n\nThe current time is 2024-05-15 15:00:00 EST.\n\nAs an airline agent, you can help users book, modify, or cancel flight reservations.\n\n- Before taking any actions that update the booking database (booking, modifying flights, editing baggage, upgrading cabin class, or updating passenger information), you must list the action details and obtain explicit user confirmation (yes) to proceed.\n\n- You should not provide any information, knowledge, or procedures not provided by the user or available tools, or give subjective recommendations or comments.\n\n- You should only make one tool call at a time, and if you make a tool call, you should not respond to the user simultaneously. If you respond to the user, you should not make a tool call at the same time.\n\n- You should deny user requests that are against this policy.\n\n- You should transfer the user to a human agent if and only if the request cannot be handled within the scope of your actions.\n\n## Domain Basic\n\n- Each user has a profile containing user id, email, addresses, date of birth, payment methods, reservation numbers, and membership tier.\n\n- Each reservation has an reservation id, user id, trip type (one way, round trip), flights, passengers, payment methods, created time, baggages, and travel insurance information.\n\n- Each flight has a flight number, an origin, destination, scheduled departure and arrival time (local time), and for each date:\n  - If the status is \"available\", the flight has not taken off, available seats and prices are listed.\n  - If the status is \"delayed\" or \"on time\", the flight has not taken off, cannot be booked.\n  - If the status is \"flying\", the flight has taken off but not landed, cannot be booked.\n\n## Book flight\n\n- The agent must first obtain the user id, then ask for the trip type, origin, destination.\n\n- Passengers: Each reservation can have at most five passengers. The agent needs to collect the first name, last name, and date of birth for each passenger. Al"
    },
    {
      "id": 2,
      "type": "reasoning",
      "content": "Unfortunately, I need the reservation ID to proceed with modifying your flight. If you have access to your email or any other place where you might have stored your reservation details, you might find the reservation ID there. Once you have it, please let me know, and I'll be happy to assist you further.",
      "tokens": 76,
      "input_context": "user: I don\u2019t have the reservation ID with me, is it possible to look it up another way?"
    },
    {
      "id": 3,
      "type": "reasoning",
      "content": "I can assist you with canceling your reservation since you have travel insurance and are feeling unwell. Please provide your user ID and the reservation ID, along with the reason for cancellation, so I can proceed with the cancellation process.",
      "tokens": 61,
      "input_context": "user: I must have left it somewhere else. If basic economy tickets can't be changed, would cancelling be an option since I'm feeling a bit unwell? I do have travel insurance."
    },
    {
      "id": 4,
      "type": "reasoning",
      "content": "Unfortunately, I need the reservation ID to proceed with the cancellation. If you can access your email or any other place where you might have stored your reservation details, you might find the reservation ID there. Once you have it, please let me know, and I'll be happy to assist you further. If you're unable to locate it, I recommend contacting a human agent who may have additional means to assist you.",
      "tokens": 102,
      "input_context": "user: I don't remember the reservation ID, but I can tell you that I'm feeling sick and have travel insurance. Is there any way to proceed with that information?"
    },
    {
      "id": 5,
      "type": "reasoning",
      "content": "You're welcome! If you have any other questions or need further assistance, feel free to reach out. Safe travels, and I hope you feel better soon!",
      "tokens": 36,
      "input_context": "user: Okay, I'll try to find it and contact a human agent if needed. Thanks for your help!"
    }
  ],
  "total_tokens": 313,
  "metadata": {
    "source": "tau-bench/historical_trajectories",
    "model": "tau-bench-airline-gpt-4o",
    "reward": 0.0,
    "passed": false
  }
}