{
  "trace_id": "agentinstruct-os_0",
  "agent_name": "agentinstruct-os",
  "framework": "raw",
  "task_value_score": 1.0,
  "steps": [
    {
      "id": 1,
      "type": "tool_call",
      "content": "Think: First, locate .conf files in the current directory.\n\nAct: bash\n\n```bash\nls *.conf\n```",
      "tokens": 40,
      "tool_name": "bash",
      "tool_params": {
        "command": "ls *.conf"
      },
      "input_context": "Now, I will start a new problem in a new OS. My problem is:\n\nFilter out all the empty lines and comments in configurations (.conf) files in the current directory, and find the most frequently appearing valid configuration directive.",
      "output": "The output of the OS:\n\nsample1.conf  sample2.conf\nroot@39909a690694:/#",
      "tool_success": true
    },
    {
      "id": 2,
      "type": "tool_call",
      "content": "Think: Then I need to concatenate the files and filter out the empty lines and comment lines.\n\nAct: bash\n\n```bash\ncat *.conf | grep -v \"^$\" | grep -v \"^#\"\n```",
      "tokens": 75,
      "tool_name": "bash",
      "tool_params": {
        "command": "cat *.conf | grep -v \"^$\" | grep -v \"^#\""
      },
      "output": "The output of the OS:\n\nparameter = value\ndirective = xyz\ndirective = abc\nUserDir disabled\nanother_val = xyz\ndirective = abc\nroot@39909a690694:/#",
      "tool_success": true
    },
    {
      "id": 3,
      "type": "tool_call",
      "content": "Think: Now we need to process the lines to extract the configuration directives. The configuration directives generally start with a non-blank character and end with the first blank. We can use awk to split on the equal or the first blank, then output the first field.\n\nAct: bash\n\n```bash\ncat *.conf | grep -v \"^$\" | grep -v \"^#\" | awk -F '[ =]' '{print $1}'\n```",
      "tokens": 115,
      "tool_name": "bash",
      "tool_params": {
        "command": "cat *.conf | grep -v \"^$\" | grep -v \"^#\" | awk -F '[ =]' '{print $1}'"
      },
      "output": "The output of the OS:\n\nparameter\ndirective\ndirective\nUserDir\nanother_val\ndirective\nroot@39909a690694:/#",
      "tool_success": true
    },
    {
      "id": 4,
      "type": "tool_call",
      "content": "Think: Now we have got the configuration directives. Let's sort the results and get the counts of each directive.\n\nAct: bash\n\n```bash\ncat *.conf | grep -v \"^$\" | grep -v \"^#\" | awk -F '[ =]' '{print $1}' | sort | uniq -c\n```",
      "tokens": 84,
      "tool_name": "bash",
      "tool_params": {
        "command": "cat *.conf | grep -v \"^$\" | grep -v \"^#\" | awk -F '[ =]' '{print $1}' | sort | uniq -c"
      },
      "output": "The output of the OS:\n\n      1 UserDir\n      1 another_val\n      3 directive\n      1 parameter\nroot@39909a690694:/#",
      "tool_success": true
    },
    {
      "id": 5,
      "type": "tool_call",
      "content": "Think: Finally, use \"awk\" to find the most frequently appearing directive. \n\nAct: bash\n\n```bash\ncat *.conf | grep -v \"^$\" | grep -v \"^#\" | awk -F '[ =]' '{print $1}' | sort | uniq -c | sort -nr | head -1 | awk '{print $2}'\n```",
      "tokens": 69,
      "tool_name": "bash",
      "tool_params": {
        "command": "cat *.conf | grep -v \"^$\" | grep -v \"^#\" | awk -F '[ =]' '{print $1}' | sort | uniq -c | sort -nr | head -1 | awk '{print $2}'"
      },
      "output": "The output of the OS:\n\ndirective\nroot@39909a690694:/#",
      "tool_success": true
    },
    {
      "id": 6,
      "type": "reasoning",
      "content": "Think: I have found the most frequently appearing valid configuration directive, which is \"directive\".\n\nAct: answer(directive)",
      "tokens": 31
    }
  ],
  "total_tokens": 414,
  "metadata": {
    "source": "huggingface:zai-org/AgentInstruct",
    "dataset": "zai-org/AgentInstruct",
    "row_id": "os_0",
    "domain": "os",
    "task": "Filter out all the empty lines and comments in configurations (.conf) files in the current directory, and find the most frequently appearing valid configuration directive."
  }
}
